{
  "id": "map_demo_001",
  "name": "데모 맵",
  "grid": {
    "width": 8,
    "height": 8
  },
  "blocked_tiles": [
    { "x": 3, "y": 3 },
    { "x": 3, "y": 4 }
  ],
  "spawns": [
    { "unit_id": "char_hero_001", "side": "ally", "x": 1, "y": 1 },
    { "unit_id": "char_enemy_001", "side": "enemy", "x": 6, "y": 6 }
  ],
  "triggers": [
    { "id": "trg_stage_start", "event": "stage_start", "action": "play_dialogue:dlg_intro" }
  ]
}
